rating,content
5,"이번달에 신혼때부터 살던 곳에서 좀 더 넓은 집으로 이사를 하게 되었는데요.<br>매번 저녁에 설겆이 하는 모습이 안쓰러웠는지 남편이&nbsp;#식기세척기&nbsp;를 구매해주었어요!!<br>바로 이번에 새로나온&nbsp;#삼성식기세척기&nbsp;인데요.<br><br>새로 이사온 전주인분이 식세기를 사용하셨는지 다행히 자리가 있어서 바로 설치가 가능하였어요.&nbsp;<br>저희는 #삼성12인용식기세척기&nbsp;를 설치하였어요.&nbsp;<br>#한국형맞춤코스 로 유명한 삼성식기세척기는&nbsp;#99.999% 살균세척&nbsp;기능과&nbsp;#4단입체물살강력세척 으로 믿고 사용할수 있는&nbsp;#12인용식기세척기에요.<br>제가 구매한 식기세척기는&nbsp;모델명 DW60T7045FS&nbsp;는&nbsp;플라스틱 변형없이 유해세균과 바이러스를 99.999%살균하는 최적의 온도 75&deg;C로 안심하고 사용&nbsp;할수 있어요.<br>그리고 세척할때마다 신선한 물을 공급해주는&nbsp; 안심 직수 시스템으로 더욱 안정적이에요.<br>깔끔하게 배수구와 직수 튜브를 설치기사님들이 연결해주셨어요!!<br>혹시나 물이 고이거나 <em>문제가 있음</em> 바로 연락달라고 하시며 가시더라고요.<br>정말 가전 들어올때마다 느끼지만 삼성설치기사님들은 친절하신거 같아요.<br>기름진 음식을 먹었어도 걱정 없는&nbsp;강력한 물살과 4개의 날개가 넓은 면적을 세척해주고,&nbsp;하단의 양방향 동시 구동되는 720&deg; 무빙 세척날개가 오염이 심한 식기도 깔끔하게 마무리를 해주어요.<br>오목한 공기에 눌어붙은 밥풀이나 고추가루 양념은&nbsp;스팀불림으로 세척코스를 추가하면 고온 애벌세척으로 깔끔하게 가능해요.<br>또 한국에서 자주 쓰는 오목한 그릇을 꽂기 쉽고,&nbsp;접을수 있는 접시꽂이와 높이조절이 식기바구니로 공간을 효율적으로 사용할수 있고, 하단 웨이브 구조 선반은 물고임 현상을 줄어주어요.<br>식기세척기는 전용세제를 사용해주셔야 하는건 모두 아시죠???<br>식기세척기 린스를 사용하시면 건조시 물자국을 남기지 않아요.<br> 세제만 넣어 사용해 보았어요.<br>세척과정이 끝나면&nbsp;문이 열려 내외부 공기가 순환되면서 건조 성능을 높여주는데요.<br>저절로 열리는게 너무나 신기하더라고요.<br>식기세척기 세척 전과 후 모습 어떠신가요???<br>왜 식기세척기 하시는지 아시겠죠?&nbsp;<br>내가 설겆이를 하는것보다 더 깨끗하게 <em>세척이되고</em>, 저녁 후 설겆이로 사용했던 시간을 아이와 함께 보낼수 있어서 더욱 좋아요!!!<br>냄비와 기름진 후라이팬 밥솥까지 깨끗하게 세척이 된 삼성식기세척기 아토맘 삶을 더욱 윤택하게 해주어요.<br>리얼 스테인러스 소재의 전면부플랫 디자인으로 주방더 고급스러운 분위기로 만들어주는&nbsp;#삼성식기세척기&nbsp;정말 너 참 <em>맘에 든다</em>~~^^"
5,"식기세척기를 알아보던 중에 DW60T7045FS 모델을 알게 되었는데 우선 12인용이라는 <em>점과 리얼 스테인리스 소재와 식기세척기 전면부의 플랫 디자인 또한 너무 마음에 들어서 </em>이 제품으로 선택하게 되었어요. 깔끔한 디자인 덕분에 주방의 인테리어와 너무 잘 어울릴 것 같다고 생각했어요. <br><br>내부를 보니까 그릇을 꽂기 쉽고 더 많은 그릇을 넣을 수 있게 효율적인 방식으로 구성되어서 한눈에 봐도 편하게 사용할 것 같았고 큼지막한 날개도 있어서 더 믿음직스러웠어요. <br>12인용이다 보니까 3,4인 가정에서 나올 수 있는 설거지의 양을 충분히 커버 할 수 있었고 기름때나 음식물 찌꺼기 역시 <em>깔끔하게 세척해주니까 너무 만족스럽더라고</em>요. <br><br>평소에는 자동이나 표준 코스를 사용하고 기름기가 많다고 생각되거나 할 때와 같은 경우에는 강력코스를 사용하고, 또 유리컵들만 따로 모아서 세척할 때도 물의 양이나 시간 또한 그에 맞게 자동으로 조절되어서 효율적이면서도 <em>내 맘대로 선택하고 세척할 수 있다는 게 제일 편한 것 같네요</em>. <br><br>간혹 플라스틱 용기들이 뜨거운 물에 의해 변형이 되면 어떡하지 라는 걱정도 들었는데 75도의 온수이기 때문에 변형이 될 일은 없어서 플라스틱도 마음 놓고 사용했네요. 개인적으로는 스팀블링 기능이 마음에 들었는데 밥풀 등을 물에 안 불려 놓으면 딱딱해져서 <em>설거지 하기도 힘들고 </em>그대로 식기세척기에 넣어도 될까 싶었는데 이 기능이 있으니까 고온으로 <em>애벌세척도 가능하니</em> 그런 걱정도 안 해도 되겠더라고요.<br><br>아 그리고 세척이 완료되면 자동으로 문이 열리는 점도 좋았는데 식기세척기를 작동해놓고 외출을 해도 세척이 끝나면 자동으로 열리는 문 덕분에 습기나 냄새 걱정 없이 외출할 수 있고 이 덕분에 자연스럽게 <em>건조도 되니까 정말 만족스러웠어요</em>. 그리고 남은 음식물은 식기세척기 내부에 있는 거름망으로 들어가기 때문에 한 번씩 깨끗하게 세척해 주는 게 좋을듯 하네요.  <br><br>식기세척기로 고민이신 분들 삼성DW60T7045FS 추천합니다 ~~~"
5,"꼼꼼한 성격이라 설거지 한번 할때마다 1시간이상 소요되는데 하고나면 어깨,팔,다리 온 몸 구석구석 안아픈데가 없었어요~엄마인 저도 설거지가 너무 하기 싫은데 아이는 놀아달라고 떼쓰고, 설거지를 하긴해야되는데 대신 해줄 사람은 없고..아빠도 한번씩 도와주지만 대부분 엄마의 몫이잖아요~<br>쌓인 설거지를 할때마다 식기세척기 있으면 얼마나 편리할까?1년이면 360시간 이상되는 시간인데 이 시간을 아이와 나한테 쓸수있겠지란 생각으로 식기세척기를 알아보게 되었는데<br>기능,디자인,가격 세가지를 충족시켜주는 제품을 발견하고 바로 주문했답니다. 2020신제품으로 나온 삼성식기세척기가 제일 메리트있었던건 #한국형맞춤세척코스 였어요~눌러붙은건 손으로 설거지해도 힘들잖아요~따로 불려놔야되는 번거로움도 있고 보통 높이가 높고 오목한 그릇이나 컵을 많이 쓰는데 트레이 거치대도 맞춤으로 설계되어있어 너무 편리했어요~ 3인가족이라 밥그릇,국그릇은 작게나오지만 반찬통이며 요리할때 나오는 여러개의 볼,냄비 후라이팬 다 들어가고도 남을 정도라 테트리스 안해도 되구요~아이가 어려서 가볍고 잘 깨지지않는 <em>플라스틱류 식기를 자주 사용하게되는데 </em>#99.999%살균세척도 되면서 75&deg;의 온도로 식기가 변형될까 걱정 안해도 되서 너무 좋았답니다.#4단입체물살강력세척으로 남는 찌꺼기 없이 꼼꼼이 씻어줘서 너무 깔끔해요~<br>장공사비도 사실 부담스러웠는데 <em>사이즈도 딱 맞아서 </em>신랑이 손쉽게 철거했구요~집에 거의 모든 가전제품들이 삼성이라 기존에 있던 실버색상의 가스렌지후드와도 찰떡이네요~삼성식기세척기로 인해 설거지옥 스트레스에서 해방되고, 여유가 생기니 삶의 질이 한층 올라갈것같아요^^"
5,"식기세척기 사려고 몇달을 고민하다 드디어 식이모님을 모셨습니다. 친정집에서 예전부터 사용하던 식세기가있는데 불려서 한번닦고돌려야하고 잘 세척도 안되고 이래저래 식세기에 대한 불신으로 그냥 손으로 하고말지 하다가 삼성에서 이번에 출시한 제품이 #한국형맞춤세척코스 가 있다고해서 구매했습니다~~~~~<br>사실 구매를 망설인 이유가 눌러붙은밥풀이나 자잘한 고추가루같은걸 애벌설거지하고 식세기를 사용해야한다는 주변이야기가 많아 그럴꺼면 설거지하고 말지 모하러 식기세척기를 사나했는데 이 식기세척기는 #한국형맞춤세척코스 스팀불림 기능이있어 애벌설거지를 해야하는 번거로움이 없다는게 구매를결정한 가장 큰이유였죠<br>장공사한 다음날 바로 받아서 사용해본결과....대만족 따따봉 이걸 여태왜안샀나 싶더라구요.<br>기사님 가시고 마침 전날 삼겹살먹은 후라이팬이있어서 고여있던 기름만 대충 키친타올로 닦고 사용했던 기름묻은 가위를 넣고 세척해봤는데 왠걸 정말 뽀득뽀득 기름기가 다 제거됬더라구요.  확실히 #4단입체물살강력세척 이란 문구에 맞는 세척력이였습니다.<br>또 밥풀 자잘한 고추가루 하나없이 뽀득뽀득하게 잘 닦인 밥그릇과 반찬그릇... 정말 깜짝놀랐습니다.<br>아기도 있기때문에 젖병도 같이 넣어서 세척해봤는데 역시 #99.999%살균세척 이란 광고문구에 걸맞게 아주 깔끔하게 세척됬더라구요.<br>75도의 온도로 세척하다보니 가끔 집에서 젖병을 잘못닦았을때 나던 우유냄새, 우유자국없이 깨끗하게 닦였더라구요. <br>아기가 있기때문에 소음도 걱정이였는데 생각보다 너무 조용해서 한번 더 놀랐습니다ㅎㅎㅎ<br>소음 동영상도 같이 첨부하겠습니다<br>이런 좋은제품만들어준 삼성정말최고!!!! 식기세척기 덕분에 아기와 놀아줄수있는 시간이 늘어나 너무 좋네요ㅎㅎㅎ 식세기는정말사랑입니다 여러분 두번세번사세요 강추!"
5,"#한국형맞춤세척코스<br>#99.999%살균세척<br>#4단입체물살강력세척<br><br>기존에 LG식기세척기를 10년간 사용했습니다.<br><br><em>사용하면서 불편했던점도 있고 해서</em> 이번에 삼성 제품을 구매하게 되었습니다.<br><br>6인용 세척기를 4명가족이 쓰기엔 너무 작아서 12인용을 선택 했습니다.<br><br>한국식기가 <em>식기세척기 사용에 불편한점이 많아</em> 무조건 12인용으로 알아보았지요.<br><br>#<em>한국형맞춤세척코스도 너무 맘에 들고</em>, 상단 바구니 높이가 조절되는 것도 한국 식기 사용하는데 많은 장점이 되네요.<br><br><em>작동 소음도 너무 조용하고 2단 바구니도 맘에 듭니다</em><br><br>요즘 3단도 많이 나오는데 <em>한국형 식기에는 2단이 더 좋은것 같아요</em><br><br>수저통도 기존에 쓰던 타입과 동일한 디자인이라 불편함도 없습니다<br><br>#99.999%살균세척 기능도 요즘같은 시기에 반드시 필요했던 기능이네요. 안심하고 우리가족의 식기를 맡길수 있을것 같습니다.<br><br>본제품과 한등급 높은 제품은 밖에 디스플레이로 남은 시간이 확인이 가능한 것인데, 10년동안 식시세척기사용하면서 시간 디스플레이가 중요한지는 잘 모르겠더라고요. 현재 진행 단계는 led로 간략하게 표기되는 것만으로도 충분하다 생각합니다.<br><br>식기세척기의 기본기능인 세척능력은 하부, 중간, 상부 3군데에서 #4단입체물살강력세척 이 이루어 지기 때문에 기름기있는 식기들도 잘 씻어지네요. 대충 겹쳐도 물살이 강력해서 <em>세척이 잘되네요</em>.<br><br><em>신상품을 좋은 기회에 구매하게 되어 너무 좋습니다</em>.<br><br>이번제품은 앞으로 10년간 우리 가족의 든든한 지원군이 될 것임을 확신합니다."
5,"이사온지 5개월째...<br><br>분양받은 집을 들어가니 해야할게 너무나 많더라구요 하고싶은것도 많구~<br><br>시스템에어컨, 인덕션..등등 다 했는데<br><br>식기세척기는 손으로 설거지를 해도 가능하니 어찌나 망설여 지던지...<br><br>5개월간 고민하다 드디어 설치했어요!!!<br><br>진짜 필요한건가 고민 많이했는데 하길잘했다는 생각.. 강추!!!<br><br>﻿<br>삼성 식기세척기는 플라스틱 변형 없이 유해세균과 바이러스를 99.999% 살균하는<br><br>최적의 온도 75도로 안심하고 사용할 수 있다고 해요~~<br><br><br><br>세척할때마다 신선한 물을 공급해 주는 안심 직수 세척 시스템으로 위생적으로 사용할 수 있어요!<br><br><br><br>더운 여름에도 식기 세척 걱정 없이 안심하고 사용할 수 있겠어요~~<br>﻿﻿<br>다들 고민할 시간에 빨리 설치하라는 식기세척기!!<br><br>왜 그렇게들 강추하는지 알꺼 같아요~~~<br><br>삼성 식기세척기 소음없이 조용하고<br><br>한국인의 식기에 안성맞춤이라 정말 강추드려요!!<br><br>불리지 않아도 밥알도 깨끗하게 닦인답니다^^"
5,동생 결혼 선물 알아보다가 리뷰가 너무 좋아서 구매 욕구가 마구 마구 생겨서 결국 제가 먼저 구매를 했는데 수요일 오후에 주문하고 토요일에 설치 받았어요.<br>프리스탠딩인데도 싱크대리폼 기사님이 먼저 방문을 해서 봐야 설치를 받을 수 있다고 하시더니 오셔서 배수관 타공을 하고 가셨는데 막상 설치받고 나니 필요없는 구멍이였어요...속상ㅜㅜ <em>알아두시면 좋을 거 같아요</em>.<br><br>세척은 해 볼 수록 더 <em>만족스러운 거 같아요</em> 그 이유가그릇 배치하는 게 문제인데 계속 해봐야 더 요령이 생길 거 같아요~아이들 온라인수업하고 밥도챙기고 설거지하고 뒤돌아서면 또 밥시간인데 이제 좀 여유가 생길 거 같아요~<br>고기 기름 때가 있는 반찬그릇도 뽀드득 물때 없이 잘 세척됩니다^^<br><br>남은 시간을 볼수없다는 단점이 있다는 글을 봤었는데 보려면 틈으로 볼수는 있는데 굳이 볼 필요는 없더라구요
5,"저도 드디어 식이모님 오셨어요ㅠㅠ<br>저희 집에는 5개월 되가는 둘째와 깔끔쟁이 4살(38개월) 첫째가 있어요.<br>5개월... 네... 분유에서 이유식 넘어가는 때입니다.<br>6개의 젖병만으로도 이미 충분히 젖병살균기는 꽉 차서 <br>이유식 용기까지 같이 살균하려니까 되게 벅차더라구요.<br>젖병살균기에 넣기 전에 젖병건조대에 쌓아서 널어두는 것마저도 박찼으니까요^^;;<br>게다가 깔끔쟁이 첫째도 한번씩 먹고 한번씩 놀이해줄 때마다 <br>살균할 것들을 추가, 추가해주셨으니 식이모를 들여야겠다 했네요~<br><br>가전은 거거익선! 크면 클수록 좋다더니 막 넣어도 되고 편하네요.<br>12인용 생각보다 커서 남편이 놀라던데, 빌트인해서 넣으니까 딱 좋네요.<br>원래 1~2시간 생각하라고 하던데 <br>장설치 기사님이 꼼꼼하셔서 2시간 20분 장공사했네요.<br>균형 맞추고 해주시느라구요.<br>곧 이어서 식세기 설치 기사님도 바로 와주셨고 <br>금방 설치하신 다음에 잘 되는지까지 많은 질문에도 웃으면서 확인해주셨어요.<br>토요일인데도 엄청 친절하셨던 두 기사님들. 이 글 보시진 않겠지만 감사감사~<br>어제 설치했는데 오늘까지 남편이 식세기를 만난 후기를 이야기합니다. <br>한 이야기하고 또 하고...<br>생각해보니 이상하게 남편이 저보다 더 좋아하는 느낌이네요...<br><br>작년에 식세기 고민할 때 <br>먼저 샀던 직장동료분께서 <br>애벌세척해야 한다는 말에 포기한 적이 있는데요~<br>#한국형맞춤세척코스가 있어서 애벌세척 안 해도 될 거 같아요.<br>저는 식세기 돌리기 전 씽크대에 모아둘 때 물에 담가두다가 넣는 정도만 하려구요.<br>좀 찜찜한 음식해먹었을 때는 &lsquo;스팀불림&rsquo;기능을 사용해도 되니까요.<br>#4단입체물살강력세척이라고 되있는 만큼 <br>평소에는 스팀불림까지는 안 해도 될 거 같구요.<br><br>그리고 사실 고온 직수 세척이랑 #세균 99.999% 살균세척이 꽃이죠.<br>많고 많은 설거지거리들, <br>특히나 아이들 자잘자잘한 것들도 막 쌓아 둘 수 있게 <br>선반이랑 바구니 잘 설계되어 있어서 좋네요.<br>12인용이라 넓어서 더 그렇기도 합니다;;<br>자동문열림 기능있어서 알아서 문열리고 건조되니까 <br>신경 안 써도 되고 건조대도 필요없어졌네요~<br><br>내년에 복직하면서 다시 맞벌이 예정이어서 <br>식<em>이모 들인 거 200프로 대만족이예요</em>.<br>항상 1명은 집안일, 1명은 아이돌보기 했거든요.<br>쉬지 못하는 저녁시간에 <br>30분~1시간의 설거지 시간의 세이브는 정말 소중할 것임을 알기에<br>임산부 친구들 2명한테도 <em>강추하렵니다</em>!!<br>산후조리하는 기간에 쌓인 설거지하면서 기분이 우울해지곤 했었는데 <br>그러지 말라구요ㅠㅠ<br>건조기 들이고도 신세계더니, 식세기도 신세계예요.<br><em>돈이 최곱니다</em>."
5,식사끝나고 설거지의 노예로 살았던 결혼생활 10년차 주부<br>이번에 새로 나온 삼성 식기세척기를 집에 들인후부터 삶이 달라졌어요<br>이 좋은 꿀템가전을 왜 이제서야 만난건가요<br>진짜 솔직하게 말해 제가 설거지한거보다 훨~~씬 깨끗하게 되고요<br>설거지할시간에 아이와 함께 공부도 하고 밖에서 놀수 있어서<br>저도 아이도 정말 <em>대만족하며</em> 사용하고 있어요<br><br>큰 궁중팬부터 냄비까지 다 들어가는 넉넉한 12인용크기<br>식사끝난후 산더미처럼 쌓여있는 그릇들보며 스트레스 받았던<br>주부생활 깔끔하게 청산했네요<br><br>늦은밤 식세기 돌려도 될만큼 <em>소음걱정 하나 없고요</em><br>세척끝난후 자동문열림기능이 있어 버튼하나 눌러두고<br>외출해도 아무 문제 없습니다<br><br>기름진 삼겹살먹으며 사용했던 가위 그대로 넣었는데<br>비포 애프터 사진 보이시나요?<br> 제가 닦은것보다 더깔끔하게 세척되서 놀랐네요<br>밥풀눌러붙어 있는 그릇세척도 스팀불림기능이 있어 문제없음<br><br>그동안 설거지의 노예로 살았던 삶 <br>삼성식세기덕분에  우아돋게 주부생활할수 있게 되었어요<br><br>고급스럽고 깔끔한 디자인이라 우리주방이 한층더<br>업그레이드된것같아 주방에 들어갈때마다 행복하네요<br><br>주방에 없어서는 안될 필수가전템이 분명합니다<br><em>강력추천합니다</em>
5,"설거지 담당 남편이 노래를 불러서 결국 구매한 식기세척기! 왜 이제야 산건지 ㅎㅎ<br>아기를 낳고 나니 제 때 설거지 하는건 진짜 어려운 일이더라구요. 그래서 쌓이다 보니 한번 할때 허리며 다리며 뽀사질 것 같구요...<br>결국 이사한 김에 20년 4월 출시된 신상으로다가 장만했어요~ 처음 무엇보다 놀란건 빌트인 장 공사랑 설치가 엄청 빠르다는 것! 그 어떤 가전, 가구보다도 결제&gt;설치가 빨라서 매우 만족스러웠어요 ~<br>생각보다 빨리 설치된 바람에 전용세제를 준비못해 오늘 아침 마트가서 사서 모아둔 그릇들 남편이 바로 돌려봤는데요, 세정은 기본이니 차치하고 건조가 생각보다 잘 되더라구요. 크고 홈이 있는 그릇은 물기가 좀 남아있지만 밥, 국그릇 수저는 물기없이 잘 말라있었어요. 몇년 전 해외거주할 때 건조기능이 없는 타사 식세기 사용했을 땐 얼룩도 많이 남고 물기 닦아내려니 귀찮아서 몇번 쓰고 말았거든요.<br>이제 2회차 돌리고 있는 중인데 첫 사용 결과는 매우 만족입니다. 뜨끈한 물로 살균세척되니 설거지 끝난 그릇 정리할 때 뿌듯해요~^^"
5,"드디어 식세기 이모님 영접 !!!!!<br><br>내가 고른건 가장 최신 모델인 #삼성전자 #DW60T7045FS #12인용 #살균세척 #스팀불림 되는 #삼성식기세척기 모델인데 4인가구이지만 12인용은 결코 큰 사이즈가 아니라는 점!<br>우리집은 씽크대 사이즈가 애매해서 처음엔 8인용을 할까 생각도 했지만. 냄비, 후라이팬 이런걸 생각해선 8인용은 작을 것 같아서 공사비가 들더라도 한번 구입할 때 제대로 된걸 구입하자! 싶었어요 ㅎ<br><br>게다가 이번에 신상품으로 나오면서 #99.999%살균세척이라 아이들이 있는집엔 더더욱 좋고 <br> #한국형맞춤세척코스 라서 한국형식기. 특히나 눌러붙은 밥풀 같은것도 한방에 잘 씻길 것 같은 느낌이 똭!!!<br><br>사전방문시 높이가 0.1~0.2미리 모자라서 설치가 된다 안된다로 엄청 맘졸였지만 설치가 똭!!<br><br>아직까지 구입 하지않고 고민하시는분들! 꼭사세요!!!<br>삶의 질이 틀려집니다~~~^^"
5,"기존 삼성 8인용을 사용하다 식구가 한명 더 늘어 조금 더 큰 식세기로 교체하려고 알아보던 중 #삼성12인용식기세척기 신제품을 구매하게 되었습니다.<br><br><em>일단 크키면에서 대만족입니다</em>. 곰국솥은 물론 궁중후라이팬까지 넣고도 그릇이 사이드에 몇개 더 들어가네요~ 윗칸의 경우에도 단을 다르게 하여 그릇이 엄청 많이 들어갑니다. 그래서 하루 한번만 돌려도 하루종일 사용한 식기를 모두 한방에 해결할 수 있습니다. 이때 눌러붙은 음식물은 스팀불림을 이용한 #한국형 맞춤 세척 코스로하니 깔끔하게 해결되네요.<br><br>많이 들어간다고 다는 아니죠. 세척력이 떨어진다면 두번, 세번 일인데 #4단 입체 물살 강력 세척기능으로 스파케티먹었던 기름진 그릇이며 삼계탕해서 먹었던 곰국솥도 깔끔하게 세척되네요. 만족도 업업! 강력 건조기능을 이용하니 8인용을 사용할때보다 <em>건조가 더 확실히 되더라구요</em>. 이점도 좋았습니다.<br><br>플라스틱 변형 걱정없이 살균하는 75도의 #99.999%살균세척기능은 앞으로 태어날 아기의 젖병을 세척하는데도 잘 쓰일 것 같아 든든합니다. 육아는 장비발, 템발이니까요^^<br><br>쌓인 설거지보면 육아스트레스까지 쌓였었는데 #삼성12인용식기세척기로 한방에 설거지 스트레스 날려버렸습니다. 고민하거나 망설이시는 분들은 꼭 <em>식기세척기 들이시길 추천</em>드립니다."
5,식세기 이모님 완젼 신세계네요. 이전부터 집밥 좋아하는 남편이 밥하는거보다 설거지가 더 힘들다는 저보고 식기세척기 하나 들이자 정말 애기 많이 했는데요. 막상 사려니 잘 될까 고민이 많아서 망설였었어요.<br><br>주변에 식기세척기 들이면 정말 세상 편하다는 애기에 삼성식기세척기 DW60T7045FS를 들였는네요. <em>정말 너무 좋네요</em>.<em>적극 추천하시는 이유를 알겠어요</em>. 저녁에 퇴근하고 밀린설겆이 하다보면 어깨가 다 부서지는 느낌인데 식기세척기에 설겆이를 맡기니 여유롭게 차한잔하는 시간까지 갖을수 있네요.<br><br>고온살균에 아이들 식판도 식기도 <em>살균도 가능하고</em> 건조기능도 세척이 끝나면 스르르 자동으로 열려 뽀송뽀송 말리기도 너무 좋구 한국형 맞춤 식기세척기라 밥그릇 밥알까지 깨끗하네요. 제가 설겆이 하는것보다 깨끗하게 되는 느낌이예요. 12인용이라 대박 냄비까지 설겆이해줍니다.<br><em>디자인도 너무 세련되서 </em>주방이 훨씬 더 예뻐진 기분이예요. 마구마구 요리하고픈 마음이 샘솟게 만드는 아이네요. 추천드려용~
5,예전부터 식세기가 너무 구입하고 싶었는데<br>이번에 삼성 신모델이 나오면서 구매했어요<br>남편과아기하나인 핵가족이라 6인용을 살까 하다가 이왕이면 가전제품은 큰게 좋다고 하여 #12인용식기세척기로 겟! 햇네용 ㅎㅎ<br>보통 집에선 주로 한식을 먹기 때문에 #<em>한국형맞춤세척코스가 있는게 너무너무 맘에 들었구요</em><br>이제 막 돌지난 아기가 있는집이라 #99.999% <em>살균세척이 되는것도 최고에요</em><br>#4단입체물살강력세척으로 꼼꼼하게 세척되네용<br>그리고 소음이 진짜 없어요<br>돌아가는지 어쩌는지 전혀모를정도에요<br>남편도 세척기 정말 조용하다고 엄지척 해줬어요<br>앞으로 식세기덕분에 여유로운 저녁시간을 보낼 수 있을것 같아요! <br>#식기세척기 <br>#설거지는식기세척기에게 <br>#DW60T7045FS
