rating,content
5,우선 진심으로 감사드려요.작년에 타사주문했다가 <em>설치안된다고해서 못했</em>거둔요.군데 요기 기사님 진짜 짱!!!.기술력.지혜력.모두... 주방에서 공사하는게 마니 두려웠는데  딱!맞는 싸이즈인 서랍장을 통으로 빼서 사용하게 해주시고 정말 맞춤으로  넘 이뿌게 설치해주셨어요..  올마나 감사한지.... 친절하신건 두말하면 잔소리... 집에모든가전 엘지인데... 와... 삼성 서비스에감동... 전날오셔서 <em>씽크대 작업해주신분 뒷 정리까지 완전 깔끔~~~ 대박감동</em>.!!!정말 복마니 받으세요~. 요새 갱년기로 넘 힘둘었는데..사고싶어도설치가 안되서 못했는데..저렇게 맞춤으로 너무너무 이뿌게 해주셨어요 . <em>가격도 엄청 저렴하게 샀구요</em>.. 진짜요즘 아파서 병원다니고 <em>마니 우울했는데 완전 기분짱이에요</em>.<em>제가 넘 좋아하니 </em>남편도 좋아라하네요.넘 잘사준거 같다고.. 진짜 다시한번 감사합니다.*^^*
5,"우선 제품 배송이 상당히 느리더군요. 굉장히 잘 팔리는 모델이기 때문에 주문이 많이 밀렸을 것 같아 이해는 됩니다. 제품 설치는 깔끔하게 잘 해주셔서 만족합니다. 제품은 상당히 좋습니다. 특히 세척력은 상당히 만족합니다. 간혹 잘 세척이 되지 않는 경우가 있지만 정말 대부분은 뽀드득 소리 나게 잘 세척이 되었습니다. 그리고 소음이 생각보다 크지 않습니다. 물론 사람마다 다르게 느낄 수는 있겠지만 상당히 조용한 모습을 보여 주었습니다. 또 정말 중요한 것은 가격인데, 이 가격에 이런 제품, 흔치 않다고 생각합니다. 역시 많이 팔리는 데는 이유가 있는 듯 합니다."
5,생각보다 빨리설치됐구요. 손목건초염으로 고생하던차 신문물을 만난기분으네요. 왜 진즉 안샀을까 싶네요. 집에 짐들이는  걸 부담스러워 하는 사람으로 꼭 필요할까가  먼저였는데   손목통증으로 고생하시는 주부님들  꼭 필요한  아이템이네요. 설거지할때 엄지 고통심한데 해방됐어요.<br>그리고 올인원 세제 쓰는데 건조는 생각보다 잘 안되네요.<br>완료되면 그냥 건조덜된건 꺼내서  말려요. 강력건조를 하면 나으려나.  아무튼 괜찮은 살림 아이템입니다
5,원래 빌트인 되어있는 아파트에 쭉 살다가식세기가 설치되어 있지 않은 아파트로 이사오고 내돈 주고 사려니 괜히 돈아까워서 그럭저럭 참고 살았어요코로나에 애들 방학에 주방을 벗어나지 못하고 살다보니 도저히 힘들어서 알아본건데  마침 행사가에 저렴해서 바로 질렀습니다. 11일 밤에 주문하고 13일에 하부장 공사하러 오시고.16일에 삼성에서 설치 해주셨어요 아마도 주말에 연휴가 끼어서 좀더 걸린것 같아요이 좋은걸 왜 미련하게 참앗나 싶어요추천 드릴만합니다.오신 기사님  두분 모두 설치 깔끔하게 .친절하셨어요
5,LG보다 <em>저렴한 가격</em>에 식세기를 장만했네요설치전에 리폼기사님이 일정 조율해서 실측하고 설치위치 조언해줍니다.리폼기사님이 굉장히 친절하고 전문적입니다.<em>주방 구조가 특이해서 추천</em>받은 3가지 방안 중 가장 저렴하게 일체형 가스오븐렌지 해체하고 설치했습니다.보통 리폼 비용을 많이 받으려고 하는데 고객 입장에서 최적의 방안으로 무료 리폼 설치 공간 마련해주셨습니다.더운데 고생 많이 하셨습니다.식세기 기능도 <em>만족스럽니다</em>.요즘 나오는 와이파이 기능은 없어도 <em>불편함은 없습니다</em>. 제조사가 중국미디어사 이지만 세척 기능 잘 됩니다.
5,"주문하고 나서 다음날 리폼 작업자분 연락 받아 그 다음날 바로 작업하셨어요. 리폼비용 13만원 감안했으나, 서랍장을 빼고 위치변경 추천해 주셔서 5만원만 지불했네요. 리폼에 대한 부담이 컸는데, 해결!그리고 그 다음날 아침 일찍 설치하러 오셨고 플러그 선 연결 구멍을 리폼 작업자분이 엉뚱한 곳에 뚫어놓는 실수를... 다시 구멍을 뚫었네요..식세기 살까말까 엄청난 시간을 고민했는데, 정말 사길 잘 했다는 생각이 들어요. 무엇보다 리폼비용 포함 50만원대에 12인용을 샀다란 것이 가장 뿌듯하네요. 건조기 샀을 때보다 더 좋아요 ㅎㅎㅎ 그런데 세척 전부터 기계 안에서 냄새나는건 사라지겠죠?? 요건 서비스센터에 확인해 봐야겠어요."
1,기존에 얻어온.sk매직 6인용식<em>세기를 만족하며</em> 쓰다10년이.넘어가며 살수기펌프고장으로 바꾸게 되는 기회가.생김그래서 같은 모델로 바꾸려다가 기존 6인용을 쓰며 아쉬웠던점이 큰접시가 세개정도로 많이.<em>들어가기 힘들고 </em>싱크대위에 있어.<em>좀 답답해보인다는 것이었어서 빌트인으로 한번 알아보다가 슬림형이 있어서 </em>고민고민하다 선택하게 됨sk매직 6인용의.장점 싱크대위에.싱크볼 바로 옆에 놓고쓰니 바로 애벌세척해서 허리굽히지않고 바로바로.넣을수 있음생각보다 커서 테트리스쌓기만 지유아2명있는.4인가족 쓰기 많이 부족하지않았음고온세척.기본이고 헹굼 2회.추가해도 건조포함 120분 빠른편싱크리폼.불필요 기존수납장 쓸 수있음단점 시각적으로.주방이 좀.답답함큰접시를 많이.넣을수없고 냄비도.제한적싱크상판 뚫어야하고.배수호수가.<em>싱크볼로 노출되어있어 불편작동소음이 크다</em>삼성 슬림빌트인 8인용 장점주방이.시각적으로 깔끔함큰접시 많이.들어가고 냄비등.조리도구도 부담없이 들어감싱크대수납장.하나만 빼면 들어가서 리폼 최소화내부에 대부분 스틸이라 위생적으로.<em>좋음소음이 거의없이 조용함종료후</em>.자동문열림기능배수관이 노출되지않아 깔끔단점  넣고뺄때.허리굽혀야하고 주변에 설겆이물이 튐수납장하나를 빼야하므로 수납공간이.줄어듬리폼비 9만원.추가지출자가가 아닌경우 원상복구의무 있는경우 빼낸 싱크장및 식세기상판 별도 보관공간 필요아스콘냄새기본이 1시간반 고온추가시 2시간 시간많이 걸림처음이라.익숙지않은건지 기존쓰던 세제가 안맞는건지 세척력이 기대보다 못함 기름때 미끌거림.남고 유리잔에 오염 많이 보임 sk쓸때는 전혀.없었던.일이라.당황스러움사용 이틀째인 현재까지는 괜히 바꿨나 싶음;;;;;적응해서 쓰는수밖에
1,"베송은 일단 10일 정도 걸려서 오래걸렸네요세척력은 그닥 만족 못하겠어요우선 삼성 물류팀에서 직접 설치해주니 깔끔하구 서비스 자체는 최고인듯요써본결과 기대만큼 깨끗히 세척되진 않아요아직은 기게보단 인간의 손이 더 꼼꼼 한듯하네요<em>대체 세척잘된다 하신</em>분들 어떤 기준에서 그런지 궁금합니다. 솔직히 에벌세척(수세미로 밥풀, 밥끈적이 다 제거 하고 고춧가루등등 이물질 제거)후에 <em>세제 용량보다 </em>많이 넣어 돌리면 그나마 깨끗하게 되고요, 우리가 상상했듯 먹던그릇 그냥 넣으면 세척 하나도 안되요 ㅋㅋㅋㅋㅋ ㅠㅠ 에벌세척 열심히 하고 물로 깨끗히 행군담에 그릇들 겹쳐지지 않게 잘 놓아야 해요. 겹치거나 물줄기 안닿은 부분은 전혀 세척 안되니 이건뭐 ㅋㅋ 그릇 넣는데만 20분 이상 소요되는데 또 몇개 안넣어도 꽉차서 1:37분 코스를 두번 돌려야 그나마 저녁 설거지를 할수있네요. 1달 써본 솔직한 주관적인 후기입니다. 20분 이상 그릇쌓아 기술적으로 잘 넣고 에벌세척 하는거 괜찮다 하시면 쓰세요."
1,엄청 고민하다 구매했습니다. <br>장크기가 50이라 셀프로 철거하고 인터넷으로 나무 조각 주문하여 그냥 옆에 끼웠어요 ㅎ <br>현재 설치후 처음 돌리면서 작성중입니다. 저희집은 음식물분쇄기가 있어서 안될줄 알았는데. 사전기사님이 된다고 하셨거든요. 근데 오늘 설치기사님은 자기기 사전전검왔으면 안된다고 했을꺼다....라고 하셔서 얼마나 놀랐는지 ㅠㅠ 그래도 다행히 저희집은 2차 처리기까지 달려있고 구조가 나와서 설치했습니다.  <br>1.냄새<br>안날줄 알았는데 가까이 가면 <em>아스콘 냄새 납니다</em>. ㅜㅜ 리뷰에 삼성은 안난다고하던데. 몇번 더 쓰면 없어지겠죠?<br>공기청정기 앞에 두고 돌리는데 다행히 정상이에요.<br>2.소음<br>너무 조용해서 작동하는지 모르겠다고 하시는분들도 계시던데. ㅋㅋㅋ 이건 진짜 아닙니다. 소음 있어요. 생각보다 물소리가 엄청 많이 들려요~ sk12인 보다 시끄러움 ~배수소음은 기계음 우우웅이 들려요 <br>3.외관 및 견고함??<br>사실 기사님이 바로 씽크대 안으로 넣어버리는 바람에 제대로 못봤어요 ~ 유격과 수평부분를 보고싶었는데.. 그냥 앞부분과 옆에서 살짝봤을때. 문짝이 오른쪽 왼쪽 높이가 좀 달라요. 그래서 손으로 꾹누르니 들어가네요?? 먼가. 삐그덕까진 아니지만. 견고하진 않은거 같아요. 어떤문 리뷰보니 기사님이 대부분이렇다 라고 해서 그냥 쓰고있단 글을 봐서 저도 쓰다가 문제되면 as받으려고요<br>궁금했던 바스켓 소재는 설치기사님 말로는 철심에 도색이라고 하던데.. 모.. 유해하지않으니 삼성이 그냥 쓰는거겠죠? ㅎ<br><em>저렴한 가격이라</em> 고민하다 설치한거니 문제없이 탈없이 잘 쓰면 좋겠네요~ <br>가장 중요한 닦임은 ㅋㅋ 아직 세제가 안와서 ㅠㅠ
1,주문결제하고나면 다음날 식세기 설치가능한위치설정과 위치정해지면 싱크대공사 시작합니다싱크대 하부장 통으로 빼서 (통으로 빼고보니 식세기 양쪽으로 공간이 남았어요 싱크대리폼비 들어서 저는 안했습니다 2.5센치씩 나눠 식세기넣으니 크게 이상하지않았어요)  그렇게 식세기공간 만들고 (이사갈때 다시 원위치가능) 걸레받이 자르고 그외에 정리다해주십니다 식세기오면 배관작업 시작해서 만들어놓은공간에 딱 넣어 설치완료해주셨어요 설명 친절하게 해주셨구요 배관에 물 세는지까지 확인다해주셔서 믿음이 갔습니다 4인가족이고 집에있는시간이 많아지다보니 설거지옥에서 벗어나고자 사기로결정했고 주문하고 딱 4일만에 설치완료 했습니다  12용은 싱크대공사를 크게해야해서 이식세기로 정했구요 단점은 건조기능이 없다는점이고 세척끝나면 자동문열림기능이 있어 약간에 건조는 가능할것 으로 보입니다 주문하고보니 할인이 들어가서 기분은 별로 안좋지만 빨리 설치완료했으니 대체적으로 만족합니다 다른곳은 세제무료증정도 있던데 안되서 아쉽네요 세제 기다려야해서 아직도 써보지 못함 사진 참고하세요
1,설치하시는분들이 대충 해놓고가서 배수구에서 누수 있고 식기세척기 문도 안닫히고 명함고 안주고가고 삼성AS연락했더니 일주일후에 오더니 물새는거 덜조여서 그런거라고 제데로 했으니 이제 누수없을거라고 하고 갔는데 또 배수구에서 누수 있어서 왔던 기사분에게 연락했더니 전화도 안받고 또 평일에 삼성AS연락하면 또 일주일뒤에 오겠죠 설치 못하는사람한테 받으니까 짜증이 많이 나에요
1,코로나 땜에 무척 사고싶어 고민 끝에 가장 <em>사이즈 대비 저렴한 모델인것 같습니다</em> <em>자연건조라 빠르지 않으며</em> 사용해보니 곧 금방 익숙해지고거의 한달쯤 사용  했는데 lc에러  코드가 떠서 어떤 버튼도 먹지 않아 이틀동안 사용을 할 수 없었습니다코로나로  어려운 as지만 신청하여 오셨는데 이틀사용을 쉬었더시 완전건조되어 작동되어 큰 수리없이 작동사용중 이예요없을때 몰랐는데 몹시 불편해지더군요각자 먹고 헹궈 식기세척기에 넣으니  그시간이 오래걸려도 잊고 다른일하니 넘편한데다음에  센서가  제발  오작동 없이  사용 할 수 있으면좋겠습니다 4인식구로 한끼 식사후 한번 쓰니  딱맞는 사이즈 였습니다 전기요금이 어느정도 나오네요 5000원 정도적지 않지만 하루 두번에서 세번 고온75도 세척한 상태로  <em>만족합니다</em> 제가 설거지 하는것 보다 깨끗한 느낌과 수세미 냄새가 안나 음식을 넣어 먹을때 불쾌감이 사라 졌습니다단점보다 전 장점을 느끼고 앞으로는 꼭 있어야할 가전제품이라  생각이 됩니다 건조기 만큼 집을 쾌적하게 만들어주는 가전이라 생각됩니다 식기건조대가 지저분하게 있었는데 없어졌기 때문에 집도 넓어 보여요
1,"그동안12인용 빌트인용 삼성식기세척기 사용해오다가..이번에 이사오면서 12인용은 설치공간이 안나와..슬림8인형으로 구매했어요. 프리스탠딩으로..싱크대 모서리 옆에 바로붙였습니다..사전방문 기사님도,설치기사님도 다 친절 하셨으나...사전방문시 설치할장소와수도배관쪽사진까지 찍어가셨고.. 추가비용 부담 안내가 없었으나..설치시 수도배관이 올라가있어서 티밸브추가적용해야해서(만오천원계좌이체함ㅡ부속비만받겠다하시는데..7천원 안팍인 부속품을..만오천원 청구하심)추가부담ㅜㅜ..친절해서  감수했습니다..다만..설명서보니..수평확인하라는데..수평확인없이..바로 연결해주고  가셨어요..그리고..자동세척없고..표준코스만있고..고온세척누르지않으면 사십도로만 세척됩니다..그리고..12인용과달리 분리세척 안됩니다.. 장단점이 다 있네요 ^^"
1,6인용 사용하다가 8인용 <em>사용하니 충분히 만족스럽네요</em>.12인용 너무 설치하고싶었지만.. 새 싱크 전체를 짜를수도 없고..결국 8인용으로 낮추었는데 <em>만족스럽습니다</em>.소음은 6인용사용했어서 그런지 크다고 생각되진않네요.<em>장 리폼해주시는 기사님께서 짜투리 부분도 쓰임있게 해주셔서 유용하게 쓸수있을것같아요</em>^^저는 주문하고 1주일 안걸렸어요^^;;;
1,오전에 오신다던 기사님이 오후로 시간약속 변경하고그것도 모자라 연락없이 2시간 가까이 딜레이..솔직히 그냥 가시라하고팟네요..시간이 늦어지면 연락해서 양해를 구해야지 무슨경우인지..설치는 금방 끝났어요..배선 안보이게 가려달라니 자재가 없다고ㅠ  설거지옥에서 해방되서 편하긴한데아스콘냄새로 머리가 아팟네요..일주일 지난 지금도 약간나긴하는데 어찌할까 고민중입니다..프리스탠딩이라서 그럴까요?소음이 생각보다 ㅠ특히 배수할때 크더라구요...늦은시간에 돌리면 신경쓰여요.
1,"4인가족쓰기엔 작다그랬는데,솔직히 건조기도 4인가족 9kg쓰는데 작다는생각 별로안들어서 식세기도 8인으로 구입했어요.솔직히 아침은 아이둘 간단히먹어서 그릇별로안나오고,저녁에 4인가족 먹은 식기나오는데 전 충분한거같아요세척력은  5점만점에 3점...겹치지도 않았고..  몇개안나온그릇 쌓기싫어서 그냥 돌렸는데도  고추기름 얼룩이 그대로였어요ㅜㅜ<em>건조는 5점만점2점</em>...  안말라요..작은 종지?같은거만 마르고 다른것들은 잘안말라요그리고 세척시간...너무길어요..너무긴거에 비해 세정력,<em>건조가 기대이하에요</em>ㅜㅜ"
1,"씽크대 공사하느라 지체되긴 했지만 친절한 설치기사님 덕분에 무사히 설치했습니다 <em>문쪽으로 전류 흐르는 느낌 없고 깔끔해요</em> 단, 새제품이라 그런지 냄새가..언제쯤 빠지려나요..<em>머리아파요</em> 그것만 빼면 아주 좋은데..---------------------두번 사용 후기입니다<em>건조 기능은 없다</em>봐도 무방할 듯자동열림은 아주 조금 열려 수동으로 더 열어줘야하고 그릇이며 수저며 물기가 그대로 있어요식세기 내부 여기저기도 마찬가지고..애벌하고 물기 있는채로 넣은 상태나 다 끝내고 꺼낸 상태나 비슷함작동시간은 표준모드 기준 1시간37분소량세체은 1시간 32분이었나..<em>아스콘 냄새인지 머리아프고</em> 기분나쁜 <em>냄새는 지금까지 나고</em>있음어차피 냄새 맡고 살거면 sk살껄..씽크대 공사하느라 여기저기 알아보느라 애쓴것도 별로임"
1,배송이 너무 늦게 옴 ㅠㅠ 2주나 지났는데도 안 와서 물어보니 4월에나 온다 해서 그냥 기억에서 지우고 언젠가 오겠지 했는데  3월 31일에 옴.. 아니 4월에 온다며.. 부랴부랴 오전에 일정 비워서 받았음. 발열과 소음잡기 위해 후판에 아스콘 발암물질이라며 냄새 난다고들 하는데 냄새는 크게 안 났음. 이게 중국전자제품 회사에서 생산하는걸 택갈이 해서 나온 제품이라서 반신반의 했는데 잘 됨. 이제 하루하루 먹은거 대충 물로 헹궈서 식기세척기에 넣어서 저녁에 자기 전에 돌려 놓으면 아침에 말끔히 말라 있음. 세제 없이 돌려도 잘 됨. 소음 부분도 처음 시작 때 말고는 조용함
1,워낙 한달걸린다고 해서 포기하고 있었는데 2주만에 연락와서 설치했네요. <em>사전점검은 별로 불만족이었고 설치는 괜찮았어요</em>.생각만큼 잘 닦이진 않지만 그래도 싱크대 안뜯고 <em>설치하긴 좋았어요</em>. 설겆이 줄어들어서 훨 편해요. 아이셋 5인 식구인데 간단히 한끼먹고 돌리기 딱 적당해요. 요리좀 한날은 따로 설겆이 좀 하긴해야하네요.<em>가성비는 정말 좋은거 같아요</em>
1,사전점검하시러 오신분은 엄청 친절하고 좋았는데 실제로 설치하러 오신분은 약속시간도 제대로 정하지도 않고 오셔서는 집에 안계시네요?  하고 전화가 와서 부랴부랴 집으로 가서 설치받았네요ㅡㅡ<br>기계성능이나 뭐 다 <em>만족합니다</em>.<br>라면 먹은건 안씻어져요. 혹시나 두번씻어봤는데도 안됨요; 그냥 물로 라면기름때이런건 한번 씻어서 넣어야합니다.<br>처음작동할땐 <em>냄새가 좀 납니다</em>.<br>그냄새가 먼지 몰라서 판매자측에 톡톡 문의남겼더니 즈그는 모르니 그냥 삼성전자에 접수하라더구요.<br>판매하고 나면 끝인가봐요?<br>서비스개선 좀 하셔야겠네요.<br>다시 살꺼냐고 물어본다면 사긴살꺼에요.<br>설거지 시간이 단축되긴합니다.<br>40분의 설거지시간대신 자유시간이 생기네요.
1,예전 동양매직 12인용 썼는데 타이머처럼 돌려쓰는 형태로 비록 소음은 컸지만시간도 1시간이내끝나고그릇이 물기가 대부분 제거됐었어요.지금은 식구가 작아서 12인용보다는 8인용이 나을것 같아 결정하고 몇번 시운전한결과90분가량걸리고물기가 많이 남아  끝난후 자연건조해야해요.ㅜㅜ대신예전보다 조용하고 자동열림있어요.증기가 빠져나가지 않아서인것같기도..sk매직보다 삼성이 최신형이라 믿고 결정했는데8인용이 모든회사가 그런지삼성이란 그런지는 모르겠어요.결정하실때 참고하세요.
1,"주문하고 3일안에 설치 기사님이 현장 보시더니 아파트랑 수전이 틀려서 다른 호스(세탁기형)이 있어야하는데 주문하면 하루 이틀이면 된다더니주문하고  약 보름 정도 걸려서 오늘에서야 설치 했습니다.설치후에 기사님들 가고 정리하다가 옆 커버가 덜렁 거리길래 봤더니 볼트 하나는 원 구멍도 아닌데 그냥 끼워 넣고, 한 군데는 볼트 조차 없었어 기사님 다시 불렸습니다. 내일 온다는데 좀 얼책 없습니다.그리고 마지막 사진 보면 문 짝이 약간 삐뚤한데 이유를 물으니 수평 맞추니 그 정도 틀렸다는데 좀 심한듯 다릿발이 움직이는걸로 아는데 세척기통 자체가 비틀리다니요. ㅡㅡ"
1,"싱크대 기본 리폼비 포함이라는 의미를 잘 모르겠네요사진에 추가한 저 한 조각으로 9만원을 냈네요이후 삼성에서 오셔서 설치해주셨고, 상품 배송/설치간 기스가 났는데 교환해드리겠다고 하셨지만 설치한거 다시 뜯고 휴가를 또 내야되서 그냥 사용하기로 했습니다아직 세제가 없어서 돌려보지는 못했어요"
1,"2~3주 기다려서 겨우 받았는데 기다리는 동안 가격 계속 내려가서 속쓰렸네요. 저렴해서 샀는데 사기 그릇은 괜찮은데 수저랑 유리는 깨끗하게 잘 안되네요,, 세제는 에코버 올인원으로 린스 포함 제품인데도 물자국이 심해요.. 무엇보다 호스 마감이 원하는대로 안되서 계속 신경 쓰이는데 직접 연장선 분리했다가 다시 끼워도 될지 심히 고민중이네요 ㅠ"
1,기존 싱크대에 12인용을 설치하면 비용이 너무 많이 들어서 8인용 설치 했어요. 기존 장제거에 9만원 지출있었어요.딱 그공간만큼 비워져있어야하는데 그러지않아서 기사님이 오셔서 공간마련하는비용인듯합니다. 시간표시되어좋고 아담하고 인테리어도 잘 어울립니다.
1,올초에 이마트에서 보고 <em>사이즈가 괜찮아서</em> 관심있던 모델이에요~지마켓에서 할인행사하길래 매장보다 훨씬 <em>저렴해서 구매했어</em>요설치톡은 안오고 2틀후에 갑자기 전화와서 예약잡고 바로 설치했네요~설치비도 무료라 더 <em>만족스러워요</em>~다만 2000와트라는데.. 에너지소비효율등급 딱지가 아예없네요... 5등급도 넘는건지 걱정은 되네요ㅠ멀티탭은 준비해야되구요설치는 싱크대 하판으로 다 넣어주셨는데 안쓸땐 전원 꺼두려고 멀티탭은 제가 따로 빼놨어요/다른분들도 <em>이렇게 첨부터 설치해달라고 하면 좋을거같아요</em>~대기전력도 무시 못하니까요 ㅎㅎ
1,<em>예쁘고 저렴하고 </em><em>사이즈도 슬림해서 보기도 좋음</em>. 냄비도 들어가는 <em>사이즈라 활용도도 좋아보임</em>. 하지만 결정적으로 <em>세척력이 좋지 않음</em>. 자동으로 설정하면 2시간 30분동안 설거지가 되는데 완전히 불려지지 않았거나 기름기가 있으면 세척이 잘 안 됨. 이제 설거지해서 넣고 헹굼용으로 활용하게 됨. 헹굼은 잘 됨. 식기세척기를 첨 써봐서 원래 이런건지??...
1,<em>상품은 만족스럽습니다</em>. 일단 좁은 주방에 별도 공사 없이 <em>설치가 가능해서 좋았고</em> <em>가격도 적당 합니다</em>. 오히려 옆에 공간이 남아서 매꿀예정입니다. <em>아스콘 냄새는 별로</em> 나지 않고 새기계 돌릴때 나는 정도 입니다. 다만 설치가 깔끔하지 않게되어 별 뺍니다. 상판과 틈이 약 1.5cm <em>나 나서 미관상 보기 좋지 않고 </em>먼지가 쌓일것 같네요. 2cm 가량 높낮이 조절되는 걸 설명서 보고 알았습니다. 다시 조절 요청 할 예정입니다. 그리고 사진 보면 좌우로 도어가 나와있는 깊이가 다릅니다. 약 0.5cm 가량 삐뚤어 졌습니다. <em>이렇게 작은 부분이 민족과 불만족이 갈리는 차이라고 봅니다</em>.
