rating,content
5,"<em>만족도가 매우 높아요</em>^^리뷰쓴다고 사은품오는것도 아니구요.자발적 리뷰씁니다^^사용한지 한달 조금 넘은것 같습니다.행사할때 구매했구요~최근에는 <em>이모델 할인 종종있는듯해요</em>.작년부터 눈여겨보다가 100넘어서 <em>고민했는데저렴하게 구매하여 매우만족해요</em>.비스포크 디자인은 시러서 그외 디자인중 골랐습니다.비스포크랑 스마트연동 외에는 기능은 비슷할거에요.<em>저렴한 가격도 만족스럽고</em>,방문해주신 기사님 노고에도 감사드립니다.높이가 맞지않아서 씽크대 컷팅이 진행되어야하는 상황이였는데설치날 기서님의  노력으로 컷팅없이 추가비용없이 설치 가능했습니다.씽크대 높이 상황이 다행히도 가능했어요.안되는걸 만든건아니고 기사님이 추가결제로이어지게 작업이 가능한데도 불구하고두번이나 방문하여 추가없이말끔하게 설치해주셨어요.너무나 <em>만족했습니다</em>.그리고 <em>삶의 여유를 느낄 수 있어서 너무만족합니다</em>.가족들이와도 설거지하느라 따로 있을 필요도없구요.음식하는게 부담스럽지도 않네요^^<em>너무너무 만족합니다</em>.<em>약간으 소음은 있으나 거슬리지않구요</em>~공청 세게 돌리는것보다 작은소리에요~저는 두시간 코스로 사용을하는데요건조까지되는 시간이라서 길다고 생각안합니다.건조되면 바로 정리해서 주방이 오히려 깨끗해졌어요^^이것저것 제품 고민한 <em>시간이 아깝구요</em>.없던생활보다 무조건 낫답니다^^"
5,7월 21일 주문해서 8월 13일 드디어 설치했습니다~<br>기존 삼성12인용 식세가 고장나 새로 구입하게 되었는데<br>역시나 좋네요 <br>요즘  식세는 어디것을 사도 다 좋을것 같아요<br>기존에 식세를 쓰다보니 새로 사는데 선택이 쉬웠어요<br>12년전 만든 <em>삼성식세도 매우 만족스럽게 썼던터라 딱히 비싸게 스팀까지 갈 필요없겠다 </em>싶었어요<br>실제 써보면 스팀코스 같은거 없어도 세척력이나 사용에 아무 지장없고<br>게다가 요즘은 기술이 상향평준화 되는것 같아서<br><em>적당한 가격</em>에 사서 좋은 세제 쓰는게 정답인듯요^^<br><br>삼성이 특히 좋았던게 착한 가격도 가격이지만 <br>맨상단에도 세척날개가 따로 있고(L사는 날개 대신 스프링클러)<br><em>수저통도 따로 있다는게 맘에 들었어요</em><br>요즘 제품은 맨윗칸이 있어서 수저저분  놓을수는 있지만 이게 은근 귀찮을것도 같은데<br>수저통에 한꺼번에  꽂아놓아도 세척 잘되고 편했거든요<br><br><em>하루 돌려보고 매우 만족입니다</em>~<br>문 자동으로 열리니 진심 편하고<br>예전에 비해  완전 조용하고요<br>(돌아가나 귀 대어볼정도?)<br>23일 기다린 <em>보람 있습니다</em><br><br>사전답사 하시는분도 너무 친절하셨고<br>설치도 통보받은것 보다는 빨리 설치되서 넘 기분좋아요~<br>쓰기 전에는 이게 꼭 필요한가 싶은데<br>한번 식세를 쓰면 식세 없이는 안되게 됩니다<br>세탁기처럼 필수가전이죠<br><br>궁금한게 많아 질문도 많이하고<br>배송 독촉도 많이 했는데<br>매번 친절하게 응대해주셔서 문성전자에게 감사해요!
5,"드디어 설치를 완료했네요. 주문이 많이 밀려 9월말쯤 된다고 했는데 갑작스랍게 근처에서 취소가 생겨 운좋게 추석전에 설치를 했네요. 빨리 설치되었다고 해도 기다리기 참 힘들었네요. 리폼과 설치를 하루에 진행하느라 정신은 없었지만 설치하고 나니 만족합니다. 특히 리폼은 기존에 식기세척기가 설치되어있어 그냥 쉽게 될 줄 알았는데 싱크대 높이가 최소 818cm여 하는데 구형이라 810cm밖에 안되서 상판을 커팅해야하나 완전 고민했는데 다행히 리폼 기사님께서 요리조리 고생 많이 하셔서 상판대리석 커팅 없이 준비되고 바로 설치 되었네요,표준으로 강력건조 사용하지 않고 사용해 보니 여기저기 물기가 남아 조금 아쉽긴 하지만 그래도 만족합니다. 세척은 깨끗이 잘 닦이구요. 차곡차곡 넣는 연습을 해야 할듯합니다. 대충 넣었더니 몇개 안들어 가네요. 좋은점은 넣어 놓고 다른 일을 할 수 있어 좋네요. 기존 식세기를 거의 사용하지 않고 모셔두다가 사용하려고 하니 고장 나서 아쉬웠는데 요건 열심히 써야겠네요."
5,식세기없이 계속있다가 아가태어나고 이젠 사야할때라며 찾다가 자동문열림된다기에 <em>가격도 좋아서</em> 얼른샀네요~자리 봐주러오신기사님 설치기사님 모두 <em>서비스 넘좋았습니다</em>~~주문하고 다음날오전 자리보고 그다응날오전설치했네요설명도 꼼꼼히해주시고 가루도안날리게조심해서 해주시더라구요주방이화이트라 색때문에조금 걱정했는데 다행이 고급지게 잘어울리네요~~<em>작동도잘되구요</em><em>살짝아쉬운건 설치할때 세제를 조금 주고</em>가시면 어떨까해요~~주문은해놨는데 식세기가더빨리와서^^;;;옆집에빌려돌렸네요ㅎㅎ그리고 <em>건조가조금 아쉬워</em>요물고임이있어서 그릇을 다시 살짝 뒤집지않는이상 밤새 문열어놔도 마르진않네요~세정력은 최고예요~<em>넘맘에들어요</em>~~~^^상품권도 꼭 보내주세요~~~이가격으로 식세기를 살줄은 꿈에도몰랐네요^^;;
5,"15일에 주문해서 어제 사전점검, 오늘 설치 완료 했습니다.기사님들도 친절하셨고, 설명도 자세히 해주셨어요.건조가 안되고 물기가 남아있다는 후기를 보고 기사님께 문의해보았는데요.열풍건조기능이 없는 모델이라고 합니다. (이부분에 좀 의아했는데 국산 외산 불문하고 대부분의 세척기가 그렇다네요. 비스포크 신상엔 열풍건조가 들어간 모델이 있다고 합니다.)기존에 쓰던 구형 모델은 보상판매 행사라 반납했는데, 오히려 사용하던 구형모델엔 있던 기능이었거든요.그런데 건조 알고리즘이헹굼시 물온도로 그릇을 데운후 자동문열림이 되면서 더운수증기가 빠져나가 자연건조가 빨리 되는 원리라고 합니다.(세척 완료시 바로 확인했을때 물기가 남아있는건 정상)표준세척시 물온도는 55도, 강력건조시 세척시간이 1시간 늘어나고 마지막 헹굼물온도가 75도라 표준보다 빨리 건조가 된다고 하고요.제가 궁금했던 부분이라 들었던 부분 자세히 후기 남겨 봅니다.원래는 완전 빌트인을 생각하고 별 생각없이 빌트인이다~ 하고 구매한건데프리스탠딩 모델이고 빌트인시에는 뚜껑 탈거하여 빌트인으로 쓰는 모델입니다. 걸레받이는 빌트인 들어가는 부분만큼 통으로 잘라내야하고요.(사진참고)블랙이 메탈 느낌이라 화이트 가구랑도 잘 어울리고 전체적으로 만족합니다."
5,기존에 사용하던 식기세척기는 sk매직 제품이었는데 8년전쯤 구입한거라 세척력이나 건조상태가 아쉬웠어요.외국브랜드 포함해서 여러 제품들 두고 고민하다가 적당한 가격에 후기 좋은 제품으로 선택해서 주문했습니다.추석연휴때 구매하고 배송은 좀 걸렸으나 미리 안내받은 상태라 기다릴만 했고 사전 방문해주신 기사님이나 설치기사님 모두 친절하셔서 만족스러웠습니다.기존에 식기세척기 사용 중이라 싱크대공사는 따로 하지 않았고 기존 식기세척기는 설치기사님께서 철거후에 설치해주셨어요.구형 제품 사용하다가 새 제품 사용하니 세척력은 정말 좋네요.자동문열림 기능도 넘 좋구요. 건조가 생각만큼 바짝 되지 않는게 조금 아쉬운데 린스를 사용하면 더 좋다고 하셔서 사용해볼까 합니다.아직 식기세척기가 익숙치 않아서 설거지꺼리들 넣는건 연습이 좀 필요할것 같아요. 공간이 많이 남는 느낌?처음 사용해서 그런 고무타는 냄새 같은게 좀 나는데 사용하다보면 괜찮아지는건지 좀 알아봐야할것 같네요.고민 엄청하다가 선택한 제품인데 사진보다 실물이 훨씬 이뻐서 맘에 듭니다.좋은점과 아쉬운 점에 대해선 좀 더 사용해보고 다시 얘기하겠지만 일단은 만족합니다.
5,"기존에 있던 식세기는 오래되어 성능면에서 만족스럽지 못했는데 마침 보상판매를 하여 주문했습니다. 주문 다음날 싱크대리폼 기사님 방문연락주시고 작업완료 후  그 다음날 바로 식세기설치팀에서 연락이 왔네요 저는 전기레인지설치와 함께 진행 하느라 식세기 배송을 미뤄서 설치는 늦어졌어요. 배관이 복잡한 구조로 되어있어 설치기사님들이 고생 많으셨을텐데 친절하게 설명해주셨어요. 설치완료되고 그날 저녁 바로 사용하고싶었지만 식세기 전용세제를 미처 준비하지 못해 부랴부랴 주문 후 다음날 사용해보았네요 ㅋ 3단으로 되어있어 수저,칼, <em>포크등 집기류를 바구니에 따로 담지 않아 세척할수있어 좋아요</em>~ 2단은 <em>높낮이 조절도 가능해요</em>~!!  작동시 제대로 <em>세척되는거 맞나 생각들정도로 소음이 작아요</em> 너무 조용해서 세척이 제대로 안되나 걱정했는데 세척완료 후 식기류에서 반짝반짝 광이 납니다.  <em>좋은가격에 좋은 상품을 구입할수있어 너무 만족합니다</em>. 무엇보다 식세기 사용하면서   아이들과 함께할 수 있는 시간이 늘어난 점이 제일 좋네요요 Tip)-전기레인지와 식기세척기 함께 설치시 전기레인지 설치가 끝나야 식기세척기 설치해준다 합니다. (안전상 문제로..)   -식세기 전용세제 반드시 필요합니다.    "
5,6인용 사용하다 12인용으로 바꿨어요 진작바꿀껄 후회했네요 세척기 대로 돌리고 설거지도 하고 왜 그랬나싶어요ㅋ3단이라 너무 좋고 <em>소음도 크지 않아서 </em>맘이듭니다 색상은 블랙이라기 보다 어두운메탈이에요 가전 대부분에 비슷한 계열이라 아주 잘 어울려서 <em>만족스럽습니다</em><br>기존 세척기 반납하면 상품권도 받을수있어 더욱 좋네요<br><br>다만 삼성기사분 대부분 친절하신대 세척기 기사님은 대충대충 말씀하시고 가셔서 <em>조금 아쉬웠어요</em>
5,"배송은 좀 늦었지만 약속된 날짜에 정확하게 설치해주셨습니다.기사님 두분이 오셔서 1시간 넘게 수고하시면서 애써주셨는데 정수기 호스와 식기세척기 호스가 서로 충돌이 되서 더 많이 고생을 하셨던거 같습니다.제 경우, 기존 식기세척기가 있던 자리에 그대로 빌트인으로 설치했는데 덮개만 떼어내니까 맞춘듯이 가로 60cm 높이 82cm로 사이즈는 완벽하게 잘 맞았구요.상품 상세 페이지에 설명된 기능들을 보면서 이 제품을 선택했는데.. 막상 실제로 받고 보니 차분한 색상과우리 집 주방과의 어울림이 좋아서  더욱 만족스러웠습니다.게다가.. 설치 기사님의 프로정신 이랄까?수시로 반복해서 물을 틀어보면서 주방수도관과 정수기호스, 또 식기세척기 배관등등을 꼼꼼하게 하나씩 점검해가면서 작업을 하는 전문가로서의 열의는 정말 돋보였고설치하고 난 후에 사용법, 세제의 선택까지 설명해주셨기에 기사님의 그 수고로움과 친절함에 감동을 받았습니다.설치해주신 윤성진 팀장님께 감사의 마음을 전합니다.정말 수고 많으셨어요^^"
5,"방금 설치하고 후기 씁니다.<br>7월 20일 정도 주문한거 같은데,.주문이 밀려 이제서야 설치했어요.<br>원래 구형 식세기랑 가스오븐이 있던 자리에 하려다 거리가 먼것 같아 싱크볼이랑 가까운 곳으로 리폼 받고 설치했어요.<br>사실 구형 식세기랑 가스오븐을 저희가 미리 다 정리를 해둔 상황이라 리폼 받을땐 딱히 크게 할일이 없었어요.<br>뺀 자리는 장을 짜 넣을까 했는데 이동하면 된다 하셔서 옆으로 장 이동하고 5만원 들었습니다.<br>장이 이동 되는줄 알았으면, 미리 저희가 해 놓았을텐데 5만원 지출이 생겼네요..나사 몇개 풀고 이동하면 되는건데..<br>어제 리폼받고 다음날 바로 설치 완료했습니다. 설치는 깔끔하고 신속하게 이루어졌어요.<br><em>설치후 설명도 잘해주시고 </em>가셨습니다.<br>아직 전용세제가 없어 당장은 사용을 못할것 같네요.<br>이제 설겆이에서 해방되는거겠죠. 손으로 하는것보다 깨끗하다 하니 <em>기대가 됩니다</em>.<br>식세기는 이제 필수품이 되었네요."
5,제가원하는조건<br>12인용 3단 자동문열림 분리세척 저소음.등등 중에<br>분리세척이 안되는 단점이있었으나. 4인가족이여서그런지 매번 가득돌리게 됩니다! <br>저렴한가격ㅇㅔ 믿을 수 있는 삼성~~ <br>건조는 식기홈이나 이런데 살짝 남아있지만<br>자동문열림이있으니 만족하게건조됩니다!
5,식기세척기 기존에 3인가족 6인용 사용하다가 4인 가족이 되니 너무 작아서 불편했는데 이번에 좋은기회에 설치를 하게 된거 같아요 보상판매 해가시는거 너무 <em>마음에 들었구요</em> 삼성이라 <em>브랜드 믿고 구매했어요</em>. 장 설치 무료에 혹 했는데 저희집은 추가금 9만원있었어요 그래도 시중에 장 설치 견적보다 저렴해서 진행했구요 장설치 기사분 식세기 설치 기사분 다들 친절하시고 열심히 해주셔서 감사했어요. 식세기 생각보다 넘 조용하고 <em>색깔 디자인도 넘 좋네요</em> 아 이제 설거지에서 해방. 주방에 오래 서있으면 허리도 아픈데 이제 애벌만 해서 <em>후딱 넣고 쉴수있어 넘 좋네요</em> 특히 냄비며 <em>큰 주방용품 들어가는거 매우 만족합니다</em>.이 가격에 자동문열림도 있어서 편히 사용하겠어요ㅎ
5,기존에 sk 6인용 사용하다가 아무래도 큰 그릇들이나 냄비등은 손설거지 해야하는게 싫어서 12인용으로 다시 장만했어요. 주문하고나서 설치가능여부는 바로 다음날에 ㅎㅎ 와서 봐주셨고 기존에 12인용이 빌트인 되어있는집이라 문제없이 설치가능판정받고 설치도 그 주에 바로 받았어요. 설치비 추가없었습니다. 식기세척기 디자인도 깔끔합니다. 블랙인 저희싱크대에 잘어울려요. 식기세척기 전면부에 시간표시되는것도 맘에 듭니다.  바스켓이 3단이고 높낮이가 조절되어서 아주 큰걸 넣을때는 조절하면 되어서 가격적인 메리트로 2간살까했는데 3단사길 잘한것같아요.  12인용인데 저렴한 가격에 구매해서 너무 만족합니다.
5,설치가 오래 걸릴줄 알았는데 빠르게 설치 진행되서 좋았어요. 15년된 아파트에 빌트인 되있던 타사 식기세척기가 많이 안좋아져서 새로 구매한건데요. 오래된 모델과 비교를 해보면 문자체가 가벼워요. 그리고 기존 12인용은 2단인데 이번 삼성 식기세척기는 3단이라 집게나 가위 그리고 수저 숟가락들을 더 깨끗하게 소독할수 있는거 같아요. 2번째 칸은 높이 조절이되서 아래칸에 냄비 넣을때 올려서 공간 확보도 가능하더라구요. 여턴 바꾸길 잘했네요. 더 빨리 살껄 ㅋ 생각이 드네요;; 연식이 오래되신 분들은 꼭 사세요~ 가성비도 넘나 좋으네요~
5,"일단 식기세척기에 대해 폭풍검색을 하고 또 하고결론은 삼성으로 좁혔고,수납 바구니도 2단이 아닌 3단으로 결정!삼성전자 매장가서보니 비스포크만 나와서 간단히 설명듣고 차이를 비교하니최신건 185만원에 물살이 스텐레스에 열풍건조구멍이 있고젖병등 야간모드등 기능추가가 있더라고요~저희는 막내가 <em>초등이라 그리 기능많고</em> 최신식이 필요하지않아 요 모델로 선택하고 최저가인 이곤11번가에서 때마침 이벤트할인날에673000원에 구입하게됐네요~~^^토요일 카드결제월요일 주문확인화요일 씽크대사전점검 오셔서 1시간가까이 씽크대분리하고 가시고,수요일인 오늘 오후 드디어 설치하고 가셨네요~뿐 아리라 전원켜고 작동하는데 소리가 안나서 어~했는데 <em>가까이가니 소음이 완전 작아서</em> 안들렸다는~~~완전 좋네요~가스렌즈 후드망 두개를 넣고,후라이팬들 다 돌리는걸 첫번째 작동인데대박 완전 기름때 잘 빠지네요!!!진심 신세계의 뜻을 이해했네요~~아 좋습니다정말로~~~지금은 칼.도마,수저통 전부와냄비들을 넣고 돌리는데 냄비부분 찌든때까지 잘 빠지네요~~~♡완전 대박 가전입니다~~~망설이지마시고 구입하세요!!때마침 색도 저희 정수기랑 같고,세탁실 문 열면 건조기랑도 색이 같아서세트같네요~<em>고급지고 이쁩니다</em>~~~^^"
5,"기존 사용하던 빌트인 삼성 식세기가 자주 말썽을 부려 이참에 새로 구매했습니다.식세기를 주문하고 기다리는 동안 시트지로 씽크대 리폼도 했는데, 구매한 식세기 색상이랑 비슷하게 칼라 매치가 잘 되서 부엌 공간이 더 새롭게 바뀌었어요.10월 1일 주문하고, 5일 사전점검 오셨구, 6일 설치 되었습니다.프리스탠딩 모델로 주문해서 빌트인으로 설치했습니다.기존꺼보다 세척기 내부 공간이 많이 넓어서 좋구요, 무엇보다도 작동시 너무 조용해서 깜짝 놀랐습니다.전면에 부착되어 있는 워런티 스티커는 따로 동봉되어 왔길래 그냥 저 위치에 붙였어요.보통은 다 붙여진채로 오던데.고장 없이 오래 잘 썼으면 좋겠네요.가격, 제품 모두 만족합니다."
5,"보름정도 사용한거같습니다.너무만족하고있고요. 소음은 있지만 엄청큰건아니고요.사람들이 말하는 신세계가 뭔지알겠더라고요.저는 설겆이를 엄청싫어하는데요즘에는 접시도 팍팍 쓰고 있네요.아직 테트리스맞추기가 능숙하지는 않지만, 계속쓰다보면 나아지겠죠. 매번 잘닦였나 확인하며 감탄중입니다.물에 잘불리면 기름기도 잘제거되는데나무주걱같이 꼭 잘불려야하는거는 잘될때도 아닐때도 있었습니다. 건조까지하면 2시간이던데 저는 표준모드로 55분만 돌리고 꺼내서 실온건조시켜요.저녁먹고 돌리고 실온건조시키고 자고 일어나서 아침에 그릇정리해요. 무튼 만족합니다.땡큐"
5,"20년전 구입한 식세기 빼고 설치 했는데, 넘좋아요^^사진을 보시면 알겠지만, 20년전 레어템 식세기 네요^^ 구경들 하세요~ㅎ20년동안 10번도 안쓰고 자연사 했습니다. 걍~ 자동으로 고장^^;그당시 엄청 비싸게 샀지만, 설거지도 잘안돼고 그냥 불편해서~ 어머니께서 10번도 못쓴것 같아요!이번에 구입한 기종은 저렴한 기종이지만, 높이조절도 되고, 수저 설거지칸이 따로 있어서 정말 유용 합니다.어머니도 20년전에 샀던거랑 너무 다르다면서 이제는 식세기를 쓰신다고 합니다.20년전 구입한 식세기 외에도 6인용도 사드렸지만, 작아서 불편 하시다고 그것도 10번 미만 사용이네요...ㅋㅋㅋ이번에 구입한건 뽕을 뽑길 기원 합니다!배송은 15일쯤 걸린것 같아요~ 추석에 다들 구입을 많이 하셔서 밀렸다고 합니다.설치 기사님들도 잘하셨지만, 설치 하루전 방문한 싱크대 기사님 정말 대단히 수고 많으 셨네요~너무 고생을 많이 하셔서 지금도 미안해서 몸둘바 모르겠네요!아무튼 우여곡절후에 설치한 식세기 맘에 듭니다!그리고 대처도 잘하신~문성전자도 칭찬 드립니다!!"
5,8월10일주문 31일 설치완료ㅠ3주걸렸네요오래걸렸지만 <em>기다리길 잘했어요</em>너무 <em>마음에듭니다</em>싱크대하고 컬러도잘맞고 예뻐요생각보다 큼직해서 놀랐네요지금 세제넣고 그릇다꺼내서 돌려보는중입니다깨끗이 잘되겠죠이상품 리뷰도많이보고 블로그도 많이봐서성능은 익히들어 알고있어요근데 예상보다 더 조용하네요 <em>굿굿돌아가는건가</em>?싶어서 중간에 열어봣더니...ㅋㅋㅋ잘되네요 <em>쿠폰할인도 크게해주고 정말 싸게 잘샀어요</em> 최고~~~~~가전제품 삼성으로 다 바꾸는중인데 만족도 이거랑 건조기가 젤높아요~~잘쓸게여 오래오래  썼으면..
5,지난주에 주문했는데 주말끼고 3일만에 장공사 완료해주시고 그 다음날 바로 연락주셔서 아침부터 설치해주고 가셨어요ㅎㅎ 코드선과 먼곳에 설치하려고해서 멀티탭 긴것 사두느라 바빴네요~ 원하던 위치에 최대한 맞춰 설치해주시고 옆에 수납장 작게 잘라 만드느라 9만원 추가비 냈는데 식기세척기 세제랑 주방 용품들 넣기 좋게 유용한 공간이 생겼어요. <em>디자인 말할것도 없이 예뻐요</em> 색상 고민했는데 저희집 주방 웜그레이라 글램베이지로 선택했는데 색감은 잘 어울리면서 톤 차이가 생겨 <em>주방이 밝아보이고 만족도 높아요</em>! 오늘 설치 받아서 사용은 아직인데 테스트해보니 배수랑 잘되요^^ 당연히 믿는 가전이니 당연 <em>세척은 잘될</em>거라 생각합니다~ 그런데 설치해주고 가시니 나중에 손잡이에 기스가ㅠㅠ 묻은건줄 알았는데... <em>그 부분 아쉽네요</em>~ <em>설치후 꼼꼼히 살펴보시는게 좋으실</em>거에요전반적으로 매우 잘 샀다고 생각하고 많이 고민했는데 후련하고 좋아요! 보상판매까지 해서 <em>가격도 너무 착합니다</em>
5,처음 식세기  이모님을 모시기 위해<br>매장에도  가보고 인터넷 후기를 두루<br>섭렵하고 최종 삼성 비스포크로<br>결정했습니다<br>독일 밀레는 약 100여만원 차이나고<br>자동세제 투입기능과 용랑이 다소 큰데<br>나머지 엘지와 삼성은 가격이나 색상 기능면<br>에서 별반 차이없었으나 이번 문성전자에서의<br>핫딜로 좋은 혜택에 구매하게되었습니다<br>결제이후이틀만에 리폼하고 다행히 구조가<br>맞아 별도비용없이했네요<br>색상도 기존 싱크대색상에 비해 튀지만<br>오히려 그것이 엣지있게 보이네요<br>설치기사님이친절하게 땀흘려서 설치해주어<br>감동이었고  최종 5일만에 설치완료<br>되어 기분이너무좋으네요<br><em>잘 쓰겠습니다</em><br><em>감사하고  삼성 비스포크 적극추천하고</em><br>문성전자 응원합니다
5,"1.글램화이트 이지만 완전 새하얀 화이트는 아니고 연 회색 느낌.2.주방규격이 안 맞아 리폼시공 9만원 + 음식처리기 있어서 다 배관 설치 3만원 총 12만원. (카드결제가능)3.시공후 다음날 삼성에서 설치.9월20일 주문후 22일 시공 23일 식세기 설치완료.주부습진으로 스테로이드를 달고산지 어언 7년째..결혼전에는 .. 섬섬옥수까지는 아니라도 길고~ 이쁘던 내 손이 초보 주부티 낸다고 각종 세제와 락스로 결국...스테로이드 없이는 잠도 못 잘 지경까지 왔어요.살성은 다 망가지고 갈라지고 피나고 밤마다 벅벅 긁느라 <em>정신없고</em>. 식기세척기를 사면 주부습진이 낫겠느냐? 반문이 있겠지만, 네..그래서 1년을 넘게 혼자 고민했지요.ㅜ가정주부로서 남들 다하는 설거지하나 버거워 식기세척기를 사용 하면 직무유기? 처럼..뭔가 왜 혼자 떳떳하지 못 한건지..워킹맘이면 당당히 샀을까..?ㅋ그래서 고민고민을 하다가 5살 아기를 키우는 엄마 입장으로써 플라스틱 변형걱정없이 99.999% 살균세척 해주는 외관도 너무 이쁜 비스포크를 선택 했어요~!사실 타사 제품들도 많이 고민 했지만, 비교사용후(친구집에서 2번씩 사용해 봄) 최종적으로 비스포크를 선택했습니다!!(비교시 타사의 단점은 적지 않겠습니다.)다만 비스포크의 단점은 표준시 자연건조 방식이래요.그래서 동영상에서 보이듯이 물기가 완전 건조되진 않아요.. <em>대신 강력건조 기능이 있습니다</em>.그걸 선택시 한시간은 늘어나요..헐..ㅋ표준이 1시간45분이예요...어쨋든 몇 일 사용해 본 결과 세제를 이제는 덜 만져도 된다는것과 주부습진이 좀 좋아질까? 하는 희망과 설거지하면 아픈 어깨도 안 아프고,여러모로 다~~~~~좋아요.많이많이많이요~~!!^^리뷰가 많이 길었네요~!모두 좋은제품으로 티 안나는 집안일의 스트레스에서 조금이라도 해방되시길~바라는 마음입니다 ^^"
